"Question","Answer","Category","Keywords"
"Does my personal accident policy cover temporary total disablement?","Yes, our personal accident policies provide a weekly income benefit if you are temporarily unable to work due to an accident. This helps cover your expenses during your recovery period. Call our team at +919417322364 to learn about the benefits. See more at https://insurance.cywarden.com/disability-insurance.","Disability Insurance","personal accident, temporary disablement, income benefit"
"I'm a senior citizen. Are there health plans designed for me?","Yes, we have 'Senior Citizen Health Insurance' plans designed specifically for individuals over 60. These plans have features like lower waiting periods for pre-existing diseases and cover age-related conditions. Call +918126386221 for a consultation. Learn more at https://insurance.cywarden.com/health-insurance.","Health Insurance","senior citizen, elderly care, retirement plan"
"Can I get insurance for a destination wedding in another country?","Absolutely. We offer 'Destination Wedding Insurance' that covers all the standard wedding risks, plus additional perils like travel cancellations, supplier issues in a foreign country, and guest liability. Call our event specialists at +919417322364. Read more at https://insurance.cywarden.com/event-insurance.","Event Insurance","destination wedding, international event, travel"
"If my flight is delayed overnight, does travel insurance cover my hotel stay?","Yes, the 'Trip Delay' benefit in our travel policies provides reimbursement for hotel accommodation and meals if your flight is delayed beyond a certain number of hours (typically 6-12). Contact our 24/7 travel assistance at +918126386221. Learn more at https://insurance.cywarden.com/travel-insurance.","Travel Insurance","trip delay, flight delay, hotel stay, reimbursement"
"What is 'Maternity Cover' in health insurance?","Maternity Cover is a benefit that covers expenses related to childbirth, including hospitalization, pre- and post-natal care, and in some plans, newborn baby cover. It typically has a waiting period of 2-4 years. Call +919417322364 to learn more. Find out more at https://insurance.cywarden.com/health-insurance.","Health Insurance","maternity cover, pregnancy, childbirth, newborn"
"Is my company covered if we have to recall a faulty product?","Standard liability insurance does not cover this. You need a 'Product Recall Insurance' policy, which covers the costs of recalling a product, including logistics, customer notifications, and replacement. Protect your business by calling +918126386221. Learn more at https://insurance.cywarden.com/business-insurance.","Business Insurance","product recall, product liability, manufacturing defect"
"If I am working on a major film production, what kind of insurance is needed?","Film productions require 'Film Production Insurance'. This is a package policy that covers cast, crew, equipment, sets, and protects against production delays or cancellations for a wide variety of reasons. Contact our media team at +919417322364 for a quote. Read more at https://insurance.cywarden.com/entertainment-insurance.","Event Insurance","film production, entertainment, cast insurance, media"
"Does my business interruption insurance cover closure due to a pandemic?","Standard business interruption policies often exclude pandemics. We offer specific riders or standalone 'Pandemic Business Interruption' policies that can provide coverage for such events. Please call our commercial team at +918126386221 to discuss this critical protection. Learn more at https://insurance.cywarden.com/business-insurance.","Business Insurance","pandemic, business interruption, epidemic, closure"
"Are my solar panels covered against damage from monkeys or other animals?","This can be a grey area in standard policies. Our 'Renewable Energy Equipment' endorsement for home insurance can be customized to include damage from animal interference, which is a common issue in many parts of India. Call us at +919417322364 to confirm. Learn more at https://insurance.cywarden.com/home-insurance.","Home Insurance","solar panels, animal damage, monkey menace, rider"
"What is 'Political Risk Insurance' for a business operating overseas?","'Political Risk Insurance' protects your business against losses due to political events like expropriation of assets by a foreign government, political violence, or currency inconvertibility. This is essential for any Indian company with international operations. Call +918126386221 to learn more. Read more at https://insurance.cywarden.com/business-insurance.","Business Insurance","political risk, international business, expropriation"
"I have a large collection of Indian contemporary art. How is it valued for insurance?","For art collections, we recommend a specialized 'Fine Art Policy' based on an 'Agreed Value'. This means we agree on the value of each piece at the start of the policy, often based on a professional appraisal, so there are no disputes at the time of a claim. Contact our collectibles team at +919417322364. Learn more at https://insurance.cywarden.com/collectibles-insurance.","Collectibles Insurance","art collection, agreed value, appraisal, contemporary art"
"My travel agent went bankrupt. Can I recover my holiday booking costs?","Yes, if your travel insurance policy includes 'Supplier Default' coverage. This specific benefit is designed to protect you against financial loss if your tour operator, airline, or travel agent ceases business operations. Check your policy or call us at +919417322364 to add this cover. Learn more at https://insurance.cywarden.com/travel-insurance.","Travel Insurance","supplier default, bankruptcy, travel agent, financial protection" 