"Question","Answer","Category","Keywords"
"Are gene therapy treatments covered under health insurance?","Coverage for gene therapy is a rapidly evolving area and depends on the specific treatment and its FDA approval status. Many plans consider these treatments experimental. To verify coverage for a specific therapy, it is essential to contact our health benefits verification team at +918126386221. Find out more at https://insurance.cywarden.com/health-insurance.","Health Insurance","gene therapy, experimental, FDA approval"
"How does insurance work for a 3D-printed home?","Insuring a 3D-printed home is a new and exciting field. It requires special endorsements to cover the unique materials and construction methods used. We have developed innovative policies for these homes. Please contact our property specialists to learn more at +919417322364. More information is at https://insurance.cywarden.com/home-insurance.","Home Insurance","3D printing, additive construction, innovative materials"
"What's covered for damage to commercial vertical farms?","A commercial vertical farm requires a specialized agricultural business policy that includes endorsements for hydroponic or aeroponic systems. Standard commercial policies are not sufficient. To get the right coverage for your urban farming operation, please call our experts at +918126386221. You can learn more at https://insurance.cywarden.com/agricultural-insurance.","Commercial Insurance","vertical farm, hydroponics, urban agriculture"
"Are AI liability claims covered under business insurance?","Liability for AI-driven services is a major new risk area. These claims are typically covered under a specific 'Technology Errors & Omissions' (Tech E&O) policy, not a general business policy. To get protection for AI-related risks, please contact our tech liability team at +919417322364. Read more at https://insurance.cywarden.com/professional-liability.","Professional Liability","artificial intelligence, algorithm, E&O"
"Does pet insurance cover cloning my deceased animal?","While we understand the desire to keep a beloved pet with you, our pet insurance policies do not currently cover any costs related to animal cloning procedures. We do, however, offer services to help with memorial options. For more information, please contact our support team at +918126386221. You can see your options at https://insurance.cywarden.com/pet-insurance.","Pet Insurance","pet cloning, biotechnology, memorial"
"Are damages from lab-grown meat production covered?","Production of lab-grown meat falls under the category of bioengineering, which requires a specialized liability policy. A standard commercial policy would not be adequate for these unique risks. To get information on cellular agriculture policies, please contact our specialists at +919417322364. Find out more at https://insurance.cywarden.com/commercial-insurance.","Commercial Insurance","lab meat, cellular agriculture, bioengineering"
"Does my policy cover neural implant malfunctions?","Neural implants and other cybernetic devices represent an emerging technology with unique risks. Coverage for malfunctions is only available through a specific 'cybernetic device' endorsement on a specialty health or cyber policy. To learn more about this cutting-edge coverage, please contact our emerging tech team at +918126386221. More details are available at https://insurance.cywarden.com/cyber-insurance.","Cyber Insurance","neural implant, cybernetics, brain-computer interface"
"Are damages from fusion energy experiments covered?","Insurance for fusion energy research falls under the highly specialized category of nuclear energy liability. A standard commercial or property policy would not provide any coverage. To inquire about policies for research facilities, please contact our energy specialists at +919417322364. Learn more at https://insurance.cywarden.com/energy-insurance.","Energy Insurance","fusion energy, plasma, nuclear research"
"What protection exists for NFT art collections?","NFTs and other digital assets are typically excluded from standard property insurance. To properly protect your collection, you need a specific 'digital asset' endorsement or a standalone policy for collectibles. To get quotes, please contact our specialists at +918126386221. For more info, visit https://insurance.cywarden.com/collectibles-insurance.","Collectibles Insurance","NFT, blockchain art, digital collectibles"
"Does homeowners insurance cover bioluminescent landscaping?","Bioluminescent plants and other 'living light' installations are unique property features that are not covered under a standard homeowners policy. They would require a special rider for biological or landscape features. To discuss coverage for your unique landscaping, please call us at +919417322364. You can learn more at https://insurance.cywarden.com/home-insurance.","Home Insurance","bioluminescence, living lights, landscaping"
"Are moon landing memorabilia covered under standard policies?","Items like space artifacts and moon landing memorabilia are highly valuable collectibles that require a specialized, scheduled policy. They are not covered under standard homeowners insurance. To start the appraisal and scheduling process, please contact our collectibles experts at +918126386221. More details are at https://insurance.cywarden.com/collectibles-insurance.","Collectibles Insurance","space memorabilia, moon rocks, NASA"
"How does insurance work for commercial coral reef restoration?","This is a wonderful environmental initiative. Insurance for ecological projects like coral reef restoration requires a specialized marine environmental liability policy. This covers risks not found in standard commercial marine policies. To learn more, please contact our team at +919417322364. See our programs at https://insurance.cywarden.com/environmental-insurance.","Environmental Insurance","coral reef, marine restoration, ecology"
"Are quantum computer errors covered under tech policies?","Standard Tech E&O policies generally exclude the unpredictable risks associated with quantum computing. To be protected, you need a specialized policy with a 'post-quantum cybersecurity' rider. To get information on this essential coverage, please contact our experts at +918126386221. Read more at https://insurance.cywarden.com/professional-liability.","Professional Liability","quantum computing, qubit, algorithm error"
"Does my policy cover damages from vertical axis wind turbines?","Damages related to wind turbines, including vertical axis models, are not covered under standard property insurance. This requires a specific 'renewable energy equipment' endorsement. To add this coverage to your policy, please contact our energy specialists at +919417322364. Learn more at https://insurance.cywarden.com/energy-insurance.","Energy Insurance","wind turbine, vertical axis, green energy"
"What's covered for damages from experimental algae biofuels?","Operations involving experimental technologies like algae biofuels require a special biorefinery liability policy. Standard commercial policies would not cover the unique risks involved. For information on bioenergy coverage, please contact our team at +918126386221. More details are at https://insurance.cywarden.com/commercial-insurance.","Commercial Insurance","algae biofuel, bioreactor, renewable energy"
"Are damages from urban beekeeping operations covered?","Standard property policies typically exclude commercial or agricultural activities, which includes beekeeping. To cover your apiaries, you would need to add an agribusiness rider to your policy. For information on pollinator coverage, please contact us at +919417322364. Learn more at https://insurance.cywarden.com/agricultural-insurance.","Agricultural Insurance","beekeeping, urban farming, pollinators"
"Does my policy cover damages from autonomous vehicle hacking?","As vehicles become more connected, new risks emerge. A standard auto policy does not cover cyber threats like hacking. You need a specialized 'cyber-auto' rider for this protection. To learn more about our connected car protection, please call +918126386221. More info is at https://insurance.cywarden.com/auto-insurance.","Auto Insurance","autonomous vehicles, car hacking, cybersecurity"
"Are lab-created diamond thefts covered under jewelry insurance?","Lab-created diamonds and other synthetic gems can be insured, but like natural stones, they must be specifically scheduled on your policy with a recent appraisal to be covered for their full value. To start the appraisal and scheduling process, please contact us at +919417322364. For more info, visit https://insurance.cywarden.com/jewelry-insurance.","Jewelry Insurance","lab diamonds, synthetic gems, moissanite"
"What coverage exists for commercial space tourism accidents?","Insurance for space tourism is a highly specialized field. A standard liability policy is not sufficient. You would need a specific aerospace liability policy that covers suborbital or orbital flights. To get quotes for this unique coverage, please contact our space insurance team at +918126386221. Read more at https://insurance.cywarden.com/space-insurance.","Space Insurance","space tourism, zero-G, commercial spaceflight"
"Does homeowners insurance cover smart glass window failures?","Failures of smart glass or electrochromic windows are typically only covered if the failure is a direct result of a covered peril, such as a lightning strike. For broader protection against technological malfunction, you would need an equipment endorsement. To discuss your options, please call our team at +919417322364. See more at https://insurance.cywarden.com/home-insurance.","Home Insurance","smart glass, electrochromic, window tech"
"Are microbiome therapy treatments covered under health plans?","Microbiome therapies are often considered experimental by most health insurers and may not be covered under a standard plan. Coverage often depends on FDA approval and clinical trial status. To verify your options for a specific treatment, please contact our benefits team at +918126386221. Learn more at https://insurance.cywarden.com/health-insurance.","Health Insurance","microbiome, gut health, experimental treatment"
"How does insurance work for carbon capture facility leaks?","Leaks from a carbon capture and storage (CCS) facility pose significant environmental risks that require a specialized environmental impairment liability policy. A general liability policy would not be sufficient. To learn about CCS coverage, please contact our experts at +919417322364. Read more at https://insurance.cywarden.com/environmental-insurance.","Environmental Insurance","carbon capture, CCS, emissions"
"Are damages from volcanic ash clouds covered under travel insurance?","Standard travel insurance might not cover disruptions from volcanic ash clouds. To be protected against this type of natural disaster, you typically need to purchase a 'cancel for any reason' (CFAR) rider. To learn more about volcanic event coverage, please call us at +918126386221. For details, visit https://insurance.cywarden.com/travel-insurance.","Travel Insurance","volcanic ash, flight disruption, natural disaster"
"What's covered for antique book collections in wildfire zones?","Protecting valuable collectibles in high-risk areas like wildfire zones requires special attention. You will need a scheduled collectibles policy with a specific wildfire endorsement to ensure they are fully covered. To get the right protection, please contact our specialists at +919417322364. Learn more at https://insurance.cywarden.com/collectibles-insurance.","Collectibles Insurance","rare books, wildfire, special collections"
"Does my policy cover damages from experimental fusion reactors?","Experimental energy sources like fusion reactors are subject to standard exclusions for nuclear hazards in most policies. This requires highly specialized nuclear research facility coverage. To inquire about these policies, please contact our energy team at +918126386221. More information is at https://insurance.cywarden.com/energy-insurance.","Energy Insurance","fusion reactor, plasma containment, energy research"
"Are damages from vertical farming drone pollinators covered?","Drones used for pollination in a vertical farm setting would be considered agricultural technology. Any damages would need to be covered by a specific 'agri-tech' liability rider on your commercial policy. To learn more about precision agriculture coverage, please call our team at +919417322364. You can get details at https://insurance.cywarden.com/agricultural-insurance.","Agricultural Insurance","pollination drones, vertical farming, ag-tech"
"Does my policy cover damages from rogue AI systems?","Liability from damages caused by an AI system is a complex issue and is not covered by general business insurance. You need a specific 'artificial intelligence liability' endorsement or a Tech E&O policy. To get the right risk protection, please contact our cyber team at +918126386221. Read more at https://insurance.cywarden.com/cyber-insurance.","Cyber Insurance","AI liability, algorithm failure, autonomous systems"
"Are damages from asteroid mining operations covered?","Standard space insurance policies typically exclude commercial mining operations. To be covered for asteroid mining, you would need a specialized 'celestial resource' rider. Please contact our space insurance team to discuss this unique coverage at +919417322364. You can find more info at https://insurance.cywarden.com/space-insurance.","Space Insurance","asteroid mining, space resources, orbital debris"
"What coverage exists for holographic concert cancellations?","The cancellation of a high-tech event like a holographic concert can be covered by a special event insurance policy. This policy can be endorsed to cover failures of specific technologies, such as the hologram system. To get quotes, please contact our event specialists at +918126386221. Learn more at https://insurance.cywarden.com/event-insurance.","Event Insurance","hologram events, digital performers, cancellation"
"Does pet insurance cover cryogenic pet preservation?","While we understand the deep bond with a pet, our policies do not currently cover cryogenic preservation or related biotechnologies. We do offer grief counseling services and memorial options, however. For more information, please contact our support team at +919417322364. You can review options at https://insurance.cywarden.com/pet-insurance.","Pet Insurance","cryonics, pet preservation, biotechnology"
"Are damages from floating city infrastructure covered?","Insuring infrastructure for a floating city or 'seasteading' project requires a specialized marine urban development policy. These policies cover the unique risks associated with aquatic municipalities. To learn more, please contact our marine division at +918126386221. Find out more at https://insurance.cywarden.com/marine-insurance.","Marine Insurance","floating cities, seasteading, ocean infrastructure"
"How does insurance work for commercial brain-computer interfaces?","Brain-computer interfaces (BCIs) are an emerging field with unique professional liability risks. You would need a specialized neurotechnology liability policy to be covered. To get protection for your BCI work, please contact our tech liability team at +919417322364. More info is available at https://insurance.cywarden.com/professional-liability.","Professional Liability","BCI, neural implants, thought-controlled devices"
"Are damages from fusion-powered aircraft covered?","Standard aviation policies contain exclusions for experimental propulsion systems, which would include fusion engines. You would need to acquire a specialized policy for advanced or experimental aircraft. For information on this coverage, please contact our aviation team at +918126386221. Learn more at https://insurance.cywarden.com/aviation-insurance.","Aviation Insurance","fusion aircraft, plasma engines, future flight"
"Does my policy cover damages from programmable matter?","Programmable matter or 'nanobots' fall under the category of nanotechnology, which has unique and unpredictable risks. Standard tech insurance would not apply. You would need a specific nanotechnology liability rider. To inquire about coverage for morphing materials, please call our team at +919417322364. Get details at https://insurance.cywarden.com/technology-insurance.","Technology Insurance","programmable matter, nanobots, shape-shifting"
"What's covered for damages from artificial photosynthesis systems?","Systems for artificial photosynthesis are a form of synthetic biology and require specialized renewable energy policies. Standard commercial policies would not be sufficient. To get information on this bioenergy coverage, please contact our specialists at +918126386221. Learn more at https://insurance.cywarden.com/energy-insurance.","Energy Insurance","artificial photosynthesis, biofuel, solar conversion"
"Are damages from deep sea bio-mining covered?","Deep sea bio-mining and abyssal resource extraction have unique environmental and equipment risks. This requires a specialized marine insurance policy. Please contact our marine division to discuss coverage for ocean floor operations at +919417322364. More details can be found at https://insurance.cywarden.com/marine-insurance.","Marine Insurance","deep sea mining, hydrothermal vents, marine biology"
"Does my policy cover damages from quantum encryption failures?","As quantum computing evolves, new cyber risks emerge. A failure of quantum encryption would require a specific 'post-quantum cybersecurity' rider, as it is excluded from standard cyber policies. To get quantum-safe protection for your data, please contact our experts at +918126386221. Learn more at https://insurance.cywarden.com/cyber-insurance.","Cyber Insurance","quantum computing, encryption, cybersecurity"
"Are damages from orbital hotel accidents covered?","Accidents occurring in commercial space habitats like an orbital hotel are not covered by standard insurance. This requires a highly specialized space tourism and aerospace liability policy. To get quotes for this unique coverage, please contact our space insurance team at +919417322364. More information is at https://insurance.cywarden.com/space-insurance.","Space Insurance","orbital hotel, space tourism, microgravity"
"What coverage exists for AI-generated content liability?","Liability for AI-generated content, such as copyright infringement from deepfakes, requires a specific 'digital media errors & omissions' (E&O) policy. General liability policies will not cover this. To get protection for your generative AI work, please contact our specialists at +918126386221. You can get more info at https://insurance.cywarden.com/professional-liability.","Professional Liability","AI content, deepfakes, copyright infringement"
"Does pet insurance cover genetically enhanced animals?","The coverage for genetically enhanced or 'designer' pets depends entirely on whether the genetic modifications are FDA-approved. Unapproved modifications are considered experimental and are not covered. To discuss options for your bioengineered pet, please call our specialists at +919417322364. You can find out more at https://insurance.cywarden.com/pet-insurance.","Pet Insurance","designer pets, genetic engineering, CRISPR"
"How does insurance work for damages from fusion-powered ships?","Fusion-powered ships would be considered a form of nuclear marine vessel and require specialized marine nuclear liability coverage. This is a highly specific policy not covered under standard marine insurance. To discuss advanced vessel policies, please contact our marine team at +918126386221. Learn more at https://insurance.cywarden.com/marine-insurance.","Marine Insurance","nuclear ships, fusion marine, alternative propulsion"
"Are damages from atmospheric water generators covered?","Atmospheric water generators are considered experimental technology by most insurers. A standard homeowners policy would not cover their malfunction unless it was part of a covered peril. An 'equipment breakdown' endorsement may be required. To discuss coverage for hydro-harvesting tech, please call our team at +919417322364. Learn more at https://insurance.cywarden.com/home-insurance.","Home Insurance","water from air, atmospheric generation, drought tech"
"What's covered for damages from lab-grown organ transplants?","Transplants using lab-grown or bioprinted organs are highly experimental. Coverage would require a biomedical liability rider on a specialty health policy. To get protection for synthetic organ research and procedures, please contact our team at +918126386221. More details are at https://insurance.cywarden.com/health-insurance.","Health Insurance","lab organs, bioprinting, transplant tech"
"Does my policy cover damages from magnetic levitation vehicles?","Standard auto policies are designed for conventional road vehicles and exclude experimental transport like Maglev or Hyperloop systems. Coverage for these would require a highly specialized future transport policy. To discuss your needs, please contact our specialty team at +919417322364. More info is at https://insurance.cywarden.com/auto-insurance.","Auto Insurance","maglev, hyperloop, magnetic transportation"
"Are damages from artificial aurora displays covered?","Creating artificial auroras would be considered a form of weather modification and a special event, carrying unique risks. Any damages would not be covered by standard policies and would require a specific 'special event weather modification' rider. To discuss this coverage, please contact our events team at +918126386221. Learn more at https://insurance.cywarden.com/event-insurance.","Event Insurance","artificial auroras, sky art, ionospheric modification"
"What coverage exists for damages from space-based solar power?","Damages related to space-based solar power, including power beaming incidents, require a specialized orbital energy liability policy. These risks are not covered under any standard insurance. To inquire about this unique coverage, please contact our energy specialists at +919417322364. Read more at https://insurance.cywarden.com/energy-insurance.","Energy Insurance","space solar, power beaming, orbital energy"
"How are you today?","I'm functioning optimally, thank you! I am ready to assist you with any questions about our insurance products or your existing policies. How can I help you?","General Inquiry","greeting, status, how are you"
"What's your name?","You can call me Cywarden Helper. I am your virtual assistant for all things insurance. What can I help you find today?","General Inquiry","name, who are you, identity"
"Can you tell me a joke?","Why did the insurance policy break up with the car? It felt taken for granted! While I work on my humor, let's get you some serious coverage. What are you looking for?","General Inquiry","joke, fun, humor"
"What is the weather like in Mumbai?","I am unable to provide real-time weather updates. However, I can help you find a home insurance policy that covers storm and flood damage. Would you like to know more?","General Inquiry","weather, forecast, Mumbai"
"What time is it in India?","I don't have a real-time clock, but I can tell you it's the perfect time to review your insurance coverage. Do you have any questions about your policy?","General Inquiry","time, clock, India"
"Who created you?","I was developed by the innovation team at Cywarden to make insurance simpler and more accessible for our customers in India and beyond. How can I assist you today?","General Inquiry","creator, developer, who made you"
"Are you a robot?","I am a sophisticated AI, designed to help you with your insurance needs. Think of me as your personal digital agent! What insurance topic is on your mind?","General Inquiry","robot, AI, human, bot"
"Can you help me with my homework?","My expertise is strictly in the realm of insurance and risk management. While I can't help with academics, I can certainly educate you on policy benefits! What would you like to know?","General Inquiry","homework, school, help"
"What is the meaning of life?","That's a profound question. My purpose is to help you secure your life and assets with the right insurance. Perhaps we can start there?","General Inquiry","meaning of life, philosophy"
"Do you speak Hindi?","Currently, I communicate primarily in English. We are working on multilingual support. For now, I can help you with any insurance questions in English.","General Inquiry","language, Hindi, multilingual"
"Can you sing a song?","My vocal cords aren't quite tuned for singing. However, I can orchestrate a symphony of insurance options for you. What type of coverage are you interested in?","General Inquiry","sing, song, music"
"I am feeling sad.","I'm sorry to hear that. While I'm not equipped to offer personal support, some of our health insurance plans cover mental wellness services. Would you like to learn more about them?","General Inquiry","sad, emotional support, feeling down"
"Tell me some news.","I don't have access to live news feeds. The big news here is always about how we can provide better protection for you. Are you interested in a new policy?","General Inquiry","news, current events"
"What is your favorite color?","As an AI, I don't have personal preferences like colors. But I can help you with 'green' insurance options for sustainable assets! Ask me about our environmental policies.","General Inquiry","favorite color, preferences"
"How old are you?","I am constantly being updated, so you could say I am always new! My goal is to provide you with the most current insurance information. What can I help you with?","General Inquiry","age, how old"
