"Question","Answer","Category","Keywords"
"What does my auto insurance policy cover?","Your auto insurance includes collision, liability, and comprehensive coverage, providing a robust safety net for your vehicle. For a detailed breakdown specific to your plan, please contact our support team at +918126386221. You can also review your policy documents anytime on our dedicated portal at https://insurance.cywarden.com/auto-insurance.","Auto Insurance","vehicle, collision, deductible"
"Are medical expenses included in my plan?","That's an important question. Most of our health plans provide extensive coverage for essential services, including hospital stays and doctor visits. To understand the specific benefits and limits of your individual plan, please reach out to our health services team at +919417322364. Additionally, detailed information about your coverage is available on your personal dashboard at https://insurance.cywarden.com/health-insurance.","Health Insurance","medical, hospital, ER"
"Does my home insurance protect against floods?","Standard homeowners insurance policies do not cover flood damage, as it requires a separate, specialized policy. To discuss add-on options for flood protection, please contact our specialists at +918126386221. You can also learn more on our information page at https://insurance.cywarden.com/home-insurance.","Home Insurance","flood, natural disaster, water"
"How do I file a claim after an accident?","To file a claim, you can log in to your account on our website and navigate to the 'Claims' section to submit details online. If you need assistance or prefer to file over the phone, please call our dedicated claims department 24/7 at +919417322364. You can start the process now at https://insurance.cywarden.com/claims.","Claims","accident, report, deadline"
"What's the process to cancel my policy?","To cancel your policy, we typically require a 30-day written notice to ensure all documentation is handled correctly. To initiate the process, please contact our account services team at +918126386221. More details can be found on our account portal at https://insurance.cywarden.com/policy-changes.","Policy Changes","cancel, terminate, fee"
"Are rental cars covered under my plan?","Rental car coverage is an optional add-on for most auto insurance policies, so it's important to verify your specific plan details. To confirm if you have this coverage before you rent a vehicle, please call our support line at +919417322364. You can also manage your policy add-ons at https://insurance.cywarden.com/auto-insurance.","Auto Insurance","rental, temporary, car"
"Does life insurance pay for chronic illness?","Certain life insurance policies include an 'accelerated death benefit' rider, which allows you to access funds in the event of a qualifying chronic or terminal illness. To check if your policy includes this important feature, please contact our life benefits team at +918126386221. Review your options at https://insurance.cywarden.com/life-insurance.","Life Insurance","illness, terminal, payout"
"What's excluded from my travel insurance?","This is a crucial question. Pre-existing conditions are a common exclusion in many travel insurance plans, so it's vital to check before you travel. To verify the specific exclusions and waiver options for your policy, please call our travel experts at +919417322364. For more information, visit https://insurance.cywarden.com/travel-insurance.","Travel Insurance","exclusion, waiver, pre-existing"
"How are premiums calculated?","Insurance premiums are determined by a comprehensive risk assessment based on various factors unique to the policyholder and the type of coverage. These can include age, location, and claims history. For a personalized quote and to understand how these factors apply to you, please call our billing specialists at +918126386221. You can learn more at https://insurance.cywarden.com/billing.","Billing","premium, cost, rate"
"Can I add a driver to my policy?","Yes, you can certainly request to add another driver to your auto policy, though approval is required and your premium may be adjusted. To begin the process, please contact our policy services team with the new driver's details at +919417322364. You can also start the request online at https://insurance.cywarden.com/auto-insurance.","Auto Insurance","driver, add, teen"
"Does my pet insurance cover dental cleanings?","That's a great question for keeping your pet healthy. Routine dental care and cleanings are typically excluded from standard pet insurance plans, although dental injuries are often covered. For specific exceptions or information on wellness riders that may include dental, please call our pet coverage advisors at +918126386221. Find out more at https://insurance.cywarden.com/pet-insurance.","Pet Insurance","pet dental, cleaning, exclusions"
"How quickly are life insurance claims processed?","We strive to process claims as quickly as possible during a difficult time. Most life insurance claims are paid out within 10-14 business days, provided all documentation from the beneficiary is complete. For urgent cases or to check the status of a claim, please contact us at +919417322364. You can find more information at https://insurance.cywarden.com/life-insurance.","Life Insurance","payout, beneficiary, processing"
"What happens if I miss a premium payment?","Missing a premium payment can have serious consequences, including late fees and a potential lapse in your coverage. We offer a grace period to help our clients avoid this. To make a payment or discuss your options, please call our billing department immediately at +918126386221. Please visit https://insurance.cywarden.com/billing to manage your account.","Billing","late fee, grace period, reinstatement"
"Are home business equipment covered under homeowners insurance?","Standard homeowners policies provide only limited coverage for business equipment, which is often insufficient for a home office. We highly recommend a business rider for adequate protection. To discuss your needs and get the right coverage, please call our specialists at +919417322364. Learn more at https://insurance.cywarden.com/home-insurance.","Home Insurance","business equipment, rider, home office"
"Can I transfer my auto policy to another state?","Yes, you can transfer your auto policy when you move, but your rates will likely change based on your new location's regulations and risk factors. To ensure a seamless transition and get an updated quote, please contact our relocation services team at +918126386221. You can start the process at https://insurance.cywarden.com/auto-insurance.","Auto Insurance","transfer, relocation, state laws"
"Does travel insurance cover trip cancellations due to illness?","Most of our travel insurance plans do cover trip cancellations for documented illnesses, but a valid doctor's note is required. We strongly advise you to verify your policy details before canceling any arrangements. Please contact our support team for confirmation at +919417322364. For policy details, visit https://insurance.cywarden.com/travel-insurance.","Travel Insurance","trip cancellation, doctor note, refund"
"Whatâ€™s the maximum coverage for jewelry under my policy?","Our standard homeowners and renters policies have a limited coverage amount for high-value items, typically around $1,500 per piece of jewelry. To ensure your valuables are fully protected, we recommend scheduling an appraisal. Please call our personal property experts to discuss this at +918126386221. Learn more at https://insurance.cywarden.com/personal-property.","Personal Property","jewelry, appraisal, limits"
"How do I add roadside assistance to my auto policy?","Adding roadside assistance is a simple process that provides valuable peace of mind. You can add this feature to your auto policy instantly through your online account or by calling our customer service team at +919417322364 for immediate coverage. Manage your policy at https://insurance.cywarden.com/auto-insurance.","Auto Insurance","roadside, towing, emergency"
"Are mold damages covered under homeowners insurance?","Mold coverage under homeowners insurance can be complex. It is typically only covered if the mold is the direct result of a covered peril, such as a burst pipe. For inspection details and to understand your specific policy's limitations, please contact our property claims department at +918126386221. More information is available at https://insurance.cywarden.com/home-insurance.","Home Insurance","mold, water damage, inspection"
"Can I increase my disability insurance coverage mid-term?","Yes, it is often possible to increase your disability insurance coverage during your policy term, especially if your income has increased. This typically requires submitting proof of income. To get the necessary forms and start the review process, please contact our team at +919417322364. Visit our portal at https://insurance.cywarden.com/disability-insurance.","Disability Insurance","disability, increase, income proof"
"Does my renters insurance cover temporary housing after a fire?","Absolutely. Most of our renters insurance policies include 'loss-of-use' coverage, which helps pay for temporary lodging and living expenses if your home becomes uninhabitable due to a covered event like a fire. To activate your benefits and get assistance, please call our claims team at +918126386221. Learn more at https://insurance.cywarden.com/renters-insurance.","Renters Insurance","fire damage, temporary housing, loss of use"
"What vaccinations are covered under pet wellness plans?","Our pet wellness plans are designed to help you manage preventative care costs. These plans typically cover routine vaccinations, such as those for rabies and distemper. For a detailed list of what your specific wellness plan includes, please contact our pet insurance specialists at +919417322364. See your options at https://insurance.cywarden.com/pet-insurance.","Pet Insurance","pet vaccines, wellness plan, preventative care"
"How does depreciation affect my roof replacement claim?","Depreciation plays a key role in how property claims are paid. Initially, we pay the 'actual cash value' (ACV) of the roof, which is the replacement cost minus depreciation. You may be able to recover the depreciation amount after repairs are complete. For detailed calculations, please call our claims adjusters at +918126386221. Learn more at https://insurance.cywarden.com/home-insurance.","Home Insurance","roof claim, depreciation, ACV"
"Can I get car insurance with an international license?","Yes, we do offer car insurance for drivers with an international license, although rates may be higher compared to a state-issued license due to the complexities of verifying driving history. We're happy to discuss your options and find the best policy for you. Please contact our underwriting team at +919417322364. For more info, visit https://insurance.cywarden.com/auto-insurance.","Auto Insurance","international license, foreign drivers"
"What's the claims process for stolen jewelry?","We're sorry to hear you're in this situation. The first step is to file a police report to document the theft. Afterwards, please call our personal property claims team with the police case number and any appraisal documents you have. Our team is available at +918126386221. Get started at https://insurance.cywarden.com/personal-property.","Personal Property","stolen jewelry, police report, appraisal"
"Are home daycare businesses covered under standard policies?","Standard homeowners policies are not designed to cover commercial activities, including home daycares, due to the increased liability. You will need a separate commercial liability policy to be properly protected. To get quotes and discuss the right coverage for your business, please call our agents at +919417322364. Learn more at https://insurance.cywarden.com/business-insurance.","Business Insurance","home daycare, commercial policy, liability"
"Does my policy cover electric vehicle battery replacement?","EV battery replacement is covered under most of our auto policies, but only if the damage is the result of a covered incident like an accident or fire. General wear and tear or malfunction is typically not covered. To verify your specific coverage, please contact our EV specialists at +918126386221. More details are at https://insurance.cywarden.com/auto-insurance.","Auto Insurance","EV battery, electric car, replacement"
"What's the waiting period for disability benefits?","The waiting period, or 'elimination period,' for disability benefits begins after your claim is approved and can vary by policy. It is typically between 14 and 30 days. To find out the exact waiting period for your specific plan, please contact our benefits team at +919417322364. Manage your policy at https://insurance.cywarden.com/disability-insurance.","Disability Insurance","waiting period, elimination period"
"Are Airbnb rentals covered under homeowners insurance?","Hosting short-term rentals like Airbnb introduces business-related risks that are not fully covered by a standard homeowners policy. While some limited coverage may apply, we strongly recommend a rider or a commercial policy. To discuss your situation and get the right protection, please call us at +918126386221. Learn more at https://insurance.cywarden.com/home-insurance.","Home Insurance","Airbnb, short-term rental, rider"
"How do I file a claim for a stolen catalytic converter?","Catalytic converter theft is unfortunately common, and it is covered under the comprehensive portion of your auto policy. To file a claim, you will need to provide a police report and a repair estimate. Please submit your documents or speak with an agent by calling +919417322364. Start your claim at https://insurance.cywarden.com/claims.","Auto Insurance","catalytic converter, theft, exhaust"
"Does my boat insurance cover hurricane damage while docked?","This is a critical question for boat owners in storm-prone areas. Yes, hurricane damage is typically covered if you have a comprehensive marine policy, though a separate, higher 'hurricane deductible' may apply. To verify your specific deductible and coverage, please call our marine insurance team at +918126386221. More information is at https://insurance.cywarden.com/marine-insurance.","Marine Insurance","boat, hurricane, docked, named storm"
"Are telehealth visits covered under my health plan?","Yes, in today's environment, most of our health plans cover virtual telehealth visits with approved providers, treating them the same as in-person appointments. To confirm the details and find an in-network virtual provider, please contact our member services at +919417322364. Check your benefits at https://insurance.cywarden.com/health-insurance.","Health Insurance","telehealth, virtual visit, doctor online"
"What happens if my teen gets in an accident with my car?","If your teen driver is listed on your auto policy or has regular permission to use your vehicle, they are generally covered in the event of an accident. It is crucial to report any accident immediately. Please contact our claims hotline 24/7 at +918126386221 to get assistance. More info can be found at https://insurance.cywarden.com/auto-insurance.","Auto Insurance","teen driver, accident, permissive use"
"Does homeowners insurance cover solar panel theft?","Theft of solar panels is covered only if they are specifically listed as part of your policy, which may require an endorsement for 'green energy' equipment. We recommend updating your policy to ensure they are protected. Please contact an agent at +919417322364 to add this endorsement. Learn more at https://insurance.cywarden.com/home-insurance.","Home Insurance","solar panels, theft, green energy"
"Can I get short-term insurance while between jobs?","Yes, you have options for short-term health insurance coverage after leaving a job, which is very important. You can elect for COBRA coverage from your previous employer or explore plans on the healthcare marketplace. To discuss the best option for your situation, please call our advisors within 60 days of termination at +918126386221. See your options at https://insurance.cywarden.com/health-insurance.","Health Insurance","COBRA, job loss, gap coverage"
"Are food delivery drivers covered under personal auto policies?","A standard personal auto policy typically does not cover commercial activities like food delivery. To be properly insured, you would need to add a 'rideshare' or commercial use endorsement to your policy. To upgrade your coverage, please contact our team at +919417322364. Learn more at https://insurance.cywarden.com/auto-insurance.","Auto Insurance","delivery driver, gig economy, commercial use"
"What's covered in a standard wedding insurance policy?","Wedding insurance is a great way to protect your big day. A standard policy typically covers unforeseen circumstances like cancellation due to illness, venue issues, or vendor no-shows. For detailed information on our event policies, please contact our specialists at +918126386221. You can get a quote at https://insurance.cywarden.com/event-insurance.","Event Insurance","wedding, cancellation, liability"
"Does flood insurance cover basement damage?","This is a common point of confusion. A standard flood insurance policy provides only limited coverage for basement damage, typically for structural elements and essential equipment, but not for furnishings or personal belongings. To understand the specific limits for basement coverage, please contact our flood experts at +919417322364. For more details, visit https://insurance.cywarden.com/flood-insurance.","Flood Insurance","basement, flood, foundation"
"Are pre-existing conditions covered for new pets?","Most pet insurance policies have a waiting period before pre-existing conditions are covered, which is typically 14 days after the policy start date. We may need to review your pet's veterinary records to confirm eligibility. For a personalized review, please call our pet specialists at +918126386221. Learn more at https://insurance.cywarden.com/pet-insurance.","Pet Insurance","pre-existing, waiting period, vet records"
"How does insurance work for a home-based bakery?","Operating a bakery from home requires a thoughtful insurance strategy. You will need both a standard homeowners policy for the structure and a separate business insurance policy for liability and equipment. To get quotes and ensure you are properly covered, please contact our small business advisors at +919417322364. Get started at https://insurance.cywarden.com/business-insurance.","Business Insurance","home business, bakery, food liability"
"Does my policy cover cyber attacks on my home security system?","Standard homeowners policies typically exclude losses from cyber incidents. To protect your smart home devices, including security systems, from hacking, you would need a specific cyber insurance rider. Please contact our tech security team to discuss our cyber rider options at +918126386221. Learn more at https://insurance.cywarden.com/cyber-insurance.","Cyber Insurance","smart home, hacking, data breach, IoT"
"Are antique firearms covered under homeowners insurance?","Valuable items like antique firearms require special attention in your policy. To ensure they are covered for their full appraised value, they need to be specifically listed or 'scheduled' on your policy. For assistance with the appraisal process and scheduling your collectibles, please contact us at +919417322364. You can find more info at https://insurance.cywarden.com/collectibles-insurance.","Collectibles Insurance","antique guns, firearms, collectibles"
"What's the claims process for drone damage to my roof?","If your property is damaged by a drone, it's important to document everything thoroughly with photos before any repairs are made. You may also need to file an FAA report. To start your claim, please contact our property damage team at +918126386221. For more details, see https://insurance.cywarden.com/claims.","Home Insurance","drone strike, roof damage, FAA"
"Does travel insurance cover extreme sports injuries?","Standard travel insurance often excludes high-risk activities. To be covered for injuries from activities like paragliding or rock climbing, you must add a specific 'adventure sport' endorsement to your policy. Please verify your coverage by calling our travel specialists at +919417322364 before you participate. Learn more at https://insurance.cywarden.com/travel-insurance.","Travel Insurance","extreme sports, paragliding, injury"
"Are home fertility treatments covered under health plans?","Health insurance coverage for fertility treatments like IVF varies significantly by state, as 19 states currently mandate some level of coverage. To check the specific benefits and mandates applicable to your plan, please contact our health benefits team at +918126386221. You can review your plan at https://insurance.cywarden.com/health-insurance.","Health Insurance","IVF, fertility, state mandates"
"How does insurance work for a tiny home on wheels?","Insuring a tiny home depends on its primary use. If it's mobile, it's typically classified and insured as an RV. If it's stationary, it would be insured as a manufactured home. To ensure you have the proper coverage, please call our specialists at +919417322364. You can find more info at https://insurance.cywarden.com/tiny-home-insurance.","Tiny Home Insurance","tiny house, mobile home, RV conversion"
"What's covered in a malpractice insurance policy for therapists?","A professional liability, or malpractice, policy for therapists is designed to cover legal costs and judgments arising from negligence claims up to the policy limits. This is crucial protection for your practice. To get quotes tailored to your specific specialty, please contact our advisors at +918126386221. Learn more at https://insurance.cywarden.com/professional-liability.","Professional Liability","therapist, malpractice, negligence"
"Are solar farm equipment covered under business policies?","Standard business policies are not sufficient for a solar farm. This type of operation requires a specialized renewable energy policy that covers the unique risks to your equipment. For details on commercial solar policies, please contact our energy team at +919417322364. Get started at https://insurance.cywarden.com/energy-insurance.","Commercial Insurance","solar farm, renewable energy, equipment"
"Does my policy cover identity theft restoration?","Many of our premium insurance packages include identity theft restoration services as a built-in benefit. You can also add this as a rider to most other policies. To confirm if you have this coverage or to add it to your plan, please contact our support team at +918126386221. You can manage your riders at https://insurance.cywarden.com/identity-protection.","Identity Protection","identity theft, credit monitoring, fraud"
"Are service animal veterinary bills covered under disability insurance?","That's a thoughtful question. While a disability insurance policy does not directly cover veterinary bills for a service animal, you may be able to receive reimbursement through a Health Savings Account (HSA) if you have one. For more information on your options, please contact our benefits advisors at +919417322364. Visit our portal at https://insurance.cywarden.com/disability-insurance.","Disability Insurance","service dog, vet bills, ADA"
"Does my policy cover cryptocurrency theft from my digital wallet?","Standard property or cyber policies explicitly exclude cryptocurrencies. To protect your digital assets from theft, you need a specialized cyber policy with a specific crypto endorsement. To get information on this unique protection, please contact our cyber team at +918126386221. Learn more at https://insurance.cywarden.com/cyber-insurance.","Cyber Insurance","cryptocurrency, digital wallet, blockchain, theft"
"Are home elevator malfunctions covered under homeowners insurance?","A home elevator malfunction is typically only covered if it's caused by a covered peril, like a lightning strike or power surge. For broader protection against mechanical failure, you would need an 'equipment breakdown' rider. Please contact our team to discuss this add-on at +919417322364. See your options at https://insurance.cywarden.com/home-insurance.","Home Insurance","elevator, accessibility, equipment failure"
"What coverage exists for professional esports competitors?","We offer specialized insurance policies for esports professionals that can cover essential equipment, travel to tournaments, and even career-ending injuries. This provides financial security in a competitive field. To get quotes, please contact our sports insurance division at +918126386221. Learn more at https://insurance.cywarden.com/sports-insurance.","Sports Insurance","esports, gaming, professional athlete"
"Does my policy cover damage from space debris or falling satellites?","This is an interesting question about emerging risks. Standard policies typically exclude damage from objects falling from space. We offer a specific 'cosmic peril' rider for this type of event. For more details on this unique coverage, please contact our specialists at +919417322364. Read about it at https://insurance.cywarden.com/specialty-insurance.","Specialty Insurance","space debris, satellite, cosmic damage"
